{
  "$ref": "#/definitions/posts",
  "definitions": {
    "posts": {
      "type": "object",
      "properties": {
        "title": {
          "type": "string"
        },
        "topic": {
          "type": "string"
        },
        "date": {
          "anyOf": [
            {
              "type": "string",
              "format": "date-time"
            },
            {
              "type": "string",
              "format": "date"
            },
            {
              "type": "integer",
              "format": "unix-time"
            }
          ]
        },
        "freshness": {
          "type": "string"
        },
        "excerpt": {
          "type": "string"
        },
        "whyItMatters": {
          "type": "string"
        },
        "exploreFurther": {
          "type": "object",
          "properties": {
            "label": {
              "type": "string"
            },
            "url": {
              "type": "string",
              "format": "uri"
            }
          },
          "required": [
            "label",
            "url"
          ],
          "additionalProperties": false
        },
        "whatToExploreNext": {
          "type": "string"
        },
        "sources": {
          "type": "array",
          "items": {
            "type": "object",
            "properties": {
              "label": {
                "type": "string"
              },
              "url": {
                "type": "string",
                "format": "uri"
              }
            },
            "required": [
              "label",
              "url"
            ],
            "additionalProperties": false
          },
          "minItems": 1
        },
        "body": {
          "type": "string"
        },
        "$schema": {
          "type": "string"
        }
      },
      "required": [
        "title",
        "topic",
        "date",
        "freshness",
        "excerpt",
        "whyItMatters",
        "exploreFurther",
        "whatToExploreNext",
        "sources"
      ],
      "additionalProperties": false
    }
  },
  "$schema": "http://json-schema.org/draft-07/schema#"
}