{
  "title": "JWST may have found a new kind of object: a black hole wrapped in a star-like cocoon",
  "topic": "Black Holes / Cosmology & Early Universe",
  "date": "2026-09-01",
  "freshness": "Published in Nature on 12 August 2026. The freshness window was expanded from 15 to 30 days because this peer-reviewed result was substantially stronger and more distinct than fresher mission or gallery items.",
  "excerpt": "Using the James Webb Space Telescope, astronomers identified an exceptionally red source called MoM-BH*-1 seen about 660 million years after the Big Bang. Its spectrum shows an unusually deep Balmer break and broad hydrogen features that the team models as an actively accreting black hole buried inside an extremely dense, turbulent, dust-free envelope of gas. In the researchers' best-fitting interpretation, the central black hole is about 100,000 times the Sun's mass and the surrounding gas cocoon is roughly the size of the Solar System, so the object looks star-like even though its power source is a black hole rather than nuclear fusion. The authors argue that this configuration could help explain the mysterious 'little red dots' seen by JWST and may reveal a phase in which early black holes grew unusually rapidly.",
  "whyItMatters": "Supermassive black holes already existed surprisingly early in cosmic history, and astronomers still do not fully understand how they grew so quickly. MoM-BH*-1 offers direct observational evidence for a long-theorized possibility: a young black hole embedded in very dense gas, potentially allowing rapid growth while also making the object appear dramatically different from a conventional accreting black hole. If similar objects turn out to be common among JWST's little red dots, astronomers may need to revise how they estimate early black-hole masses and how they reconstruct the first stages of galaxy growth.",
  "exploreFurther": {
    "label": "Nature: A gas-enshrouded and gas-reddened black hole at cosmic dawn",
    "url": "https://www.nature.com/articles/s41586-026-10846-4"
  },
  "whatToExploreNext": "Explore JWST's 'little red dots' and why their strange spectra have become one of the biggest clues to how the first massive black holes formed.",
  "sources": [
    {
      "label": "Nature",
      "url": "https://www.nature.com/articles/s41586-026-10846-4"
    },
    {
      "label": "MIT News",
      "url": "https://news.mit.edu/2026/astronomers-discover-brand-new-type-astrophysical-object-black-hole-star-0812"
    }
  ],
  "body": "## A red dot that is too bright to be a star\n\nJWST found an exceptionally red source the team calls MoM-BH*-1. In the notebook’s summary of the Nature paper, it is seen about 660 million years after the Big Bang. The spectrum is the awkward part. It shows an unusually deep Balmer break and broad hydrogen features. A Balmer break is a sharp drop in the light below certain wavelengths. Ordinary stellar atmospheres make one. Vega, a bright star in the night sky, shows the familiar version. Rohan Naidu, the lead author, says the break in this object is the deepest they have seen in anything, which is hard to square with a normal star.\n\nThere is a second oddity. The light is almost pure hydrogen and helium. Metals, the astronomer’s word for anything heavier, are missing. And the object is violently bright. MIT’s account says it puts out about 100 billion times more energy than any known star can produce by nuclear fusion. Energies like that are routine for a feeding black hole. They are not routine for a star.\n\nNaidu is a NASA Hubble Fellow and Pappalardo Fellow at MIT’s Kavli Institute. Robert Simcoe and Wendy Sun are among the MIT co-authors. They were not hunting a new kind of object. The survey is called Mirage or Miracle, MoM for short, and it was aimed at the earliest galaxies. Naidu’s line on that search is worth keeping: some of what looks like an extremely bright early galaxy, a “miracle,” may be a mirage.\n\n## Dust was the obvious guess. The spectrum refused it.\n\nVery red usually means dust. Smoke reddens a sunset; dust reddens a galaxy. Simcoe says the other signatures did not match a dust screen. The team asked a narrower question: can hydrogen alone, with no dust, make something this red? Their simulations said yes, if the hydrogen is packed so densely that it behaves more like the surface of an enormous star than like a thin nebula.\n\nThat dense screen would also soak up blue light and produce a deep Balmer break. It would hide metals if there are hardly any to begin with. It would not, by itself, explain the brightness. Fusion still cannot power it. So they put an accreting black hole in the middle of the hydrogen cocoon and varied the mass until the fake spectrum sat near the real one.\n\n## The fit, and what is still a model\n\nThe best-fitting picture, in the paper’s interpretation and in Naidu’s description, is a central black hole of about 100,000 times the Sun’s mass, wrapped in a turbulent, dust-free gas envelope roughly the size of the Solar System. The black hole does the job fusion would do in a star. The gas acts like a fake photosphere. The object looks star-like. The engine is not a star.\n\nCall that the interpretation. The observation is the red, metal-poor spectrum with the extreme break and the luminosity. The black-hole-plus-cocoon arrangement is the scenario that matched the simulations. It is not a photograph of the interior.\n\nThe team named it MoM-BH*-1: the survey, plus “black hole star, one.” They suspect it is the first of a class. Little red dots show up across JWST’s deep images and are largely gone in the nearby universe. Naidu argues that every little red dot is consistent with a black hole star sitting inside an ordinary early galaxy, and that MoM-BH*-1 is special because the black hole star outshines the host, so the light is almost uncontaminated. “Consistent with” is not “shown to be.” The dots are fainter than this one. If the same model is later used to weigh them, early black-hole masses could move, and so could the story of how the first galaxies grew. That revision is a possible consequence. It is not yet a required one.\n\nThe Nature paper is the authority for the spectral measurements and the model grid. MIT’s write-up is a clear secondary account of the same work. Both leave the little-red-dot population as an argument, which is the right size for the claim.\n"
}
