{
  "title": "Faint stars may hide extra mass in early massive galaxies",
  "topic": "Galaxies & Galactic Evolution / Stars & Stellar Evolution",
  "date": "2026-09-03",
  "freshness": "Published in Nature Astronomy on 21 August 2026.",
  "excerpt": "JWST and Very Large Telescope spectra of nine massive quiescent galaxies at a redshift of about 0.7 show excess low-mass stars in the most massive systems. The oldest, with stars formed at a redshift above 5, has the most bottom-heavy initial mass function. If similar mixes applied to their early ancestors, some galaxy masses could rise by a factor of about 4, give or take about 1.",
  "whyItMatters": "Galaxy masses at large distances assume a Milky Way mix of stellar birth masses. These spectra suggest that mix fails for the biggest quiescent systems. If the early galaxies JWST has been finding inherited the same excess of faint stars, models must assemble even more mass in less time.",
  "exploreFurther": {
    "label": "Nature Astronomy: hidden mass and bottom-heavy stellar mixes",
    "url": "https://doi.org/10.1038/s41550-026-02932-4"
  },
  "whatToExploreNext": "Look at the initial mass function, the distribution of stellar birth masses used to turn a galaxy's light into a stellar mass.",
  "sources": [
    {
      "label": "Nature Astronomy",
      "url": "https://doi.org/10.1038/s41550-026-02932-4"
    },
    {
      "label": "Penn State",
      "url": "https://pure.psu.edu/en/publications/hidden-mass-in-early-galaxies-revealed-by-bottom-heavy-initial-ma/"
    }
  ],
  "body": "## The mass you infer from the light\n\nA galaxy's stellar mass is usually inferred, not weighed. You see light. You assume a mix of bright stars and faint ones, then scale up. That mix is the initial mass function, the IMF: the distribution of masses stars have at birth. High-mass stars dominate the light and die young. Low-mass stars are faint, live a long time, and hold most of the mass. If the mix is bottom-heavy, with more faint stars than the standard assumption, the same glow hides more mass.\n\nDistant galaxies are usually assigned an IMF like the Milky Way's. The faint stars are not seen one by one. Their contribution is an extrapolation. Change the extrapolation and the mass changes, even if the spectrum you measured stays the same. JWST has been finding massive galaxies that formed and evolved faster than galaxy-formation models predicted. Many had already assembled a large mass in stars about 12 billion years ago. Those masses are only as firm as the IMF that was assumed.\n\nA Nature Astronomy paper published on 21 August 2026 goes after that assumption with full-spectrum models, fits to the whole spectrum rather than to one or two features. The title is \"Hidden mass in early galaxies revealed by bottom-heavy initial mass functions.\"\n\n## Nine quiet galaxies, not the frantic ones\n\nThe spectra are of nine massive quiescent galaxies at a redshift of about 0.7. Quiescent means star formation has largely shut down, so a fresh burst of short-lived bright stars is not dominating the light. Redshift is the stretch of light by cosmic expansion. A larger number means the light has traveled longer, and we see the galaxy further back in time. About 0.7 is not the early universe itself. It is a later, quieter view of galaxies whose stars may have formed much earlier.\n\nThe JWST spectra come from a program called the Initial Mass Function of Early Red NIRSpec Objects. NIRSpec is JWST's near-infrared spectrograph. Those data were extended to bluer wavelengths with deep spectra from the Very Large Telescope's Large Early Galaxy Astrophysics Census. The combination is what let the authors ask about low-mass stars instead of adopting the Milky Way's mix and moving on.\n\nThe measurement claim is specific. The most massive galaxies in the nine have an excess of low-mass stars. The oldest galaxy in the sample, with a formation redshift greater than 5, has the most bottom-heavy IMF. Formation redshift is the epoch the stars are estimated to have formed, which can be earlier than the epoch at which we happen to observe the galaxy. We see this one at about 0.7, after it has gone quiet. Its stars, on the team's fit, formed when redshift was still above 5.\n\n## The factor of about four is a maybe\n\nThe striking number is conditional. This oldest galaxy may be a descendant of the galaxies JWST has been calling \"impossibly early.\" If those ancestors had a similarly bottom-heavy IMF, their stellar masses would rise by a factor of approximately 4, with an uncertainty of about 1. The paper says that increase may amplify the tension with galaxy-formation models.\n\nThat reading is an interpretation. The spectra in hand are the nine quiescent galaxies. The early, still-forming systems are a different set. Carrying a bottom-heavy IMF backward, along a possible family line from a redshift above 5 to the \"impossibly early\" population, is an inference. \"May be a descendant\" is the paper's wording, and the \"may\" is doing real work. It is not a statement that these nine galaxies have been reweighed by a factor of four.\n\nIf the inference holds, the formation problem gets worse, not easier. Adding hidden low-mass stars raises the mass that had to be assembled in a short time. Models that were already strained by heavy early galaxies would be more strained. That is why a result on nine quieter systems still lands on the early universe. It does not land there as a finished census.\n\n## Where the assumption usually hides\n\nThe standard conversion from light to mass is good enough for a lot of nearby galaxies, which is why it became the default. It fails quietly. Two galaxies with the same brightness can differ in mass if one is full of faint red stars and the other is not. Star-formation history, chemical pattern, and the light from the giants all get folded into the fit. A bottom-heavy function changes how much mass you assign to the stars you cannot see.\n\nNothing here says every early galaxy is bottom-heavy. The claim is aimed at the most massive of these quiescent systems, and then, more tentatively, at their possible ancestors. The route is stellar populations, the light of the stars, not a dynamical weighing by orbital speeds. A dynamical mass, if you had one, would have to be shared among stars, gas, and dark matter. This paper does not make that split. It says the stellar piece may be larger than the Milky Way recipe implied.\n\nTreat the Nature Astronomy paper, DOI 10.1038/s41550-026-02932-4, as the authority for the spectral fits. The Penn State record carries the same abstract. The factor-of-four statement belongs in the conditional column until those ancestor galaxies are measured the same way. The useful next step is the IMF itself: the table of birth masses that turns a spectrum into a mass. Change the table, and a generation of early-galaxy masses moves with it.\n"
}
