{
  "title": "A proto-supercluster caught while the universe was 2.1 billion years old",
  "topic": "Cosmology & Early Universe",
  "date": "2026-09-12",
  "freshness": "Published in The Astrophysical Journal on 8 September 2026.",
  "excerpt": "COSMOS-z3.1-A is a proto-supercluster, a clumpy gathering of galaxies that has not finished merging, seen when the universe was 2.1 billion years old. ODIN imaging and follow-up spectra from DESI, Gemini South, and Keck place it earlier than the proto-supercluster Hyperion. Its mass is 5000 times that of the Milky Way, and the team expects fewer than one such object per 10,000 galaxy clusters.",
  "whyItMatters": "Nearby superclusters are finished products. COSMOS-z3.1-A still shows separate clumps sitting where several filaments of the cosmic web cross. That layout lets astronomers test the bottom-up picture, in which small structures form first and later merge, against a real object from when the universe was young.",
  "exploreFurther": {
    "label": "NSF NOIRLab: Extremely massive galaxy proto-supercluster smashes distance records",
    "url": "https://noirlab.edu/public/news/noirlab2622/"
  },
  "whatToExploreNext": "Follow how galaxy groups and protoclusters merge along the cosmic web into the clusters we see nearby.",
  "sources": [
    {
      "label": "NSF NOIRLab",
      "url": "https://noirlab.edu/public/news/noirlab2622/"
    },
    {
      "label": "Rutgers University",
      "url": "https://newbrunswick.rutgers.edu/news/scientists-see-one-universes-largest-structures-taking-shape"
    },
    {
      "label": "The Astrophysical Journal",
      "url": "https://doi.org/10.3847/1538-4357/ae8091"
    }
  ],
  "body": "## A supercluster that has not collapsed yet\n\nGalaxy clusters are the most massive gravitationally bound structures in the universe: hundreds to thousands of galaxies, spanning millions of light-years, held together mostly by dark matter. Nearby clusters are mature. They grew out of protoclusters, enormous loosely bound collections of galaxies that are still merging and have not settled.\n\nA proto-supercluster is one step larger and one step less finished. It is the ancestor of a cluster of clusters, several over-dense pieces that belong to one structure and have not yet fallen into a single relaxed system. COSMOS-z3.1-A is that kind of object. NSF NOIRLab's announcement calls it the earliest, most distant proto-supercluster yet identified. The paper, \"ODIN: Characterizing the Three-dimensional Structure of Two Protocluster Complexes at z = 3.1,\" is in The Astrophysical Journal, 8 September 2026, DOI 10.3847/1538-4357/ae8091.\n\nCOSMOS is the sky field. The label z3.1 is a redshift: expansion has stretched the light, and that stretch marks how long the light has been traveling. The team places this structure at a time when the universe was only 2.1 billion years old. Another proto-supercluster, Hyperion, had already been reported. COSMOS-z3.1-A is identified at an even earlier time.\n\n## From a wide camera to a depth map\n\nThe search leans on the ODIN survey, One-hundred-deg2 DECam Imaging in Narrowbands. DECam, the Dark Energy Camera, was fabricated for the Department of Energy. It has a 570-megapixel detector and sits on the U.S. National Science Foundation's Víctor M. Blanco 4-meter Telescope at Cerro Tololo Inter-American Observatory in Chile, a program of NSF NOIRLab. With that wide field, DECam spent more than 100 nights over the last three years taking deep images across a huge area of the southern sky.\n\nAn international team led by Vandana Ramakrishnan, a graduate student at Purdue University at the time of the study, used those images to look for young cluster progenitors. In total they identified 150 distant protoclusters, formed when the universe was about 1 to 3 billion years old. They then focused on two striking overdensities, COSMOS-z3.1-A and COSMOS-z3.1-C. The COSMOS field is a useful place for this work. It looks away from the crowded plane of the Milky Way, and many of the major telescopes have already spent time there.\n\nODIN supplied the flat coordinates, positions on the sky. A structure this large needs a third dimension, or a chance alignment of unrelated galaxies can mimic a pile-up. Spectrographs turn a spectrum into a distance. Ramakrishnan was joined by Byeongha Moon of the Korea Astronomy and Space Science Institute and Nicole Firestone of Rutgers University to lead that follow-up. Rutgers's news post is the other institutional account of a structure still taking shape.\n\nMost of the spectra come from DESI, the Dark Energy Spectroscopic Instrument, which can measure distances to 5000 galaxies at once. DESI was built with Department of Energy support and international partners, is operated with DOE funding, and is managed by Lawrence Berkeley National Laboratory. It rides on the NSF Nicholas U. Mayall 4-meter Telescope at Kitt Peak National Observatory in Arizona. Additional spectra come from the Gemini Multi-Object Spectrograph on Gemini South in Chile, and from the Deep Imaging Multi-Object Spectrograph, DEIMOS, on the Keck II telescope on Maunakea in Hawaii.\n\n## Heavier than Coma, rarer than a typical cluster\n\nThe 3D maps let the team predict what these structures grow into. Both COSMOS-z3.1-A and COSMOS-z3.1-C are expected to become more massive than the Coma Cluster, the largest known galaxy cluster in the local universe. A is the rarer object. It is a proto-supercluster, with a mass 5000 times that of the Milky Way. Ramakrishnan describes it as one of the most extreme, most overdense regions, and the team thinks there should be fewer than one such object for every 10,000 galaxy clusters.\n\nThose are strong claims, and they should stay attached to the map. The observation is many galaxies, confirmed as members, concentrated in clumps at this redshift, tied together in three dimensions. The forecast, more massive than Coma, is a prediction of future growth, not a weighing of a finished cluster. The rarity, fewer than one per 10,000 clusters, is the team's estimate of how unusual the overdensity is. A record also depends on definitions. Hyperion shows that the category already had a member. This object's claim is that it sits earlier.\n\nA visualization with the NOIRLab note marks confirmed members of COSMOS-z3.1-A as light-blue circles. Purple marks the thicker knots of galaxy density. A. Ortiz at Purdue built the original 3D model.\n\n## Clumps where several filaments cross\n\nThe maps show the protoclusters as very clumpy and irregular. They lie at the intersections of multiple filaments of the cosmic web, the large-scale network of matter. NOIRLab reports this as the first time such features have been directly observed in the distant universe. The layout agrees with expectations for how matter is distributed.\n\nCurrent models build structure from the bottom up. Smaller pieces form first and merge into larger ones. The clumps in these maps read as that unfinished merging. Over time the clumps should collapse together and leave clusters closer in shape to the rounder systems seen nearby. Ramakrishnan's aim for the project matches that test: the growth of massive structures, the effect those structures have on the galaxies inside them, and the way protoclusters connect to the web.\n\nThe 3D method separates a core, an outskirts, and a filament still feeding the system. In the coming decade the NSF-DOE Vera C. Rubin Observatory's Legacy Survey of Space and Time will image the southern sky every few nights, and the overlap with ODIN can follow cluster growth across cosmic time. That survey is a plan. The measurement in hand is the pair of complexes at redshift 3.1, caught while the pieces were still separate.\n"
}
