{
  "title": "Webb finds warm dust around a quiet black hole binary",
  "topic": "Black Holes",
  "date": "2026-10-01",
  "freshness": "Preprint posted September 28, 2026 and updated September 30, 2026; submitted to The Astrophysical Journal, preliminary, and within the preferred 15-day search window.",
  "excerpt": "Webb measured an unexpected mid-infrared glow from the dormant black hole binary XTE J1118+480. The spectrum fits warm dust better than the steady compact jet usually invoked for faint black hole systems, suggesting material may survive in a ring outside the binary.",
  "whyItMatters": "Quiescent black holes are difficult to study because they emit so little light. If circumbinary dust is responsible for this infrared glow, astronomers gain a new way to probe the environment left around a black hole and its companion long after the system's brightest outbursts fade.",
  "exploreFurther": {
    "label": "Read the preprint on arXiv",
    "url": "https://arxiv.org/abs/2609.36318"
  },
  "whatToExploreNext": "How can the shape of an infrared spectrum distinguish thermal emission from warm dust from synchrotron radiation produced by a compact jet?",
  "sources": [
    {
      "label": "Zuo et al., JWST/MIRI Spectroscopy of the Quiescent Black Hole X-ray Binary XTE J1118+480",
      "url": "https://arxiv.org/abs/2609.36318"
    }
  ],
  "body": "## A black hole system that is almost switched off\n\nXTE J1118+480 contains a stellar-mass black hole and a companion star, but today the system is in a quiet state. Its X-ray luminosity is about nine orders of magnitude below the Eddington luminosity, a reference level that describes how brightly an object can shine while gravity still holds onto infalling material. Even in this faint state, something around the binary continues to glow in the infrared.\n\nA team led by Zihao Zuo used the James Webb Space Telescope's Mid-Infrared Instrument to obtain a spectrum from 5 to 12 micrometres and images from 15 to 25 micrometres. They also used simultaneous optical monitoring and a radio observation that placed an upper limit of 4.5 microjanskys at 6 gigahertz. Combining those measurements let the researchers ask whether the infrared light came mainly from a compact jet or from warm dust surrounding the binary.\n\nCompact jets are common around accreting black holes. Electrons moving through magnetic fields can produce synchrotron radiation whose spectrum is often close to a flat power law over part of the radio and infrared range. That makes a jet a natural explanation for excess infrared light from a black hole system.\n\n## The spectrum bends instead of staying flat\n\nAfter subtracting the companion star's contribution, the Webb spectrum curves and turns over near 6 micrometres. A single power law does not describe that shape well. A thermal blackbody with a temperature of 764 plus or minus 9 kelvin provides a better fit. At wavelengths longer than the turnover, the measured spectral slope is also steeper than expected from a typical steady compact jet, although the difference is only about two standard deviations.\n\nThe longer-wavelength Webb images complicate the picture further. Measurements between 15 and 21 micrometres, taken about 2.6 hours before the spectrum, are roughly 30 to 90 percent brighter than an extrapolation of the shorter-wavelength spectrum. A jet model can be adjusted to approach those points, but doing so makes it harder to reproduce the observed curvature and the upper limit at 25.5 micrometres. The authors therefore do not rule out a jet, but they find that one steady, partially self-absorbed jet struggles to explain all of the infrared measurements at once.\n\n## A ring of warm material is another possibility\n\nThe team also modelled a disk of material outside the orbit of the black hole and its companion. In representative irradiated-disk models, a directly illuminated wall of dust about five binary separations from the centre can reproduce the main features of the 5 to 25 micrometre emission. The inferred minimum dust mass is of order 10^22 grams. That is tiny on stellar scales, but enough warm material to leave a clear infrared signature.\n\nThis would be circumbinary dust, meaning material orbiting around both members of the binary rather than falling directly into the black hole. The proposed dust wall lies outside the region where the binary's gravity is expected to truncate a surrounding disk, so its location is physically plausible.\n\nThe evidence is not yet decisive. The study is a preprint submitted to The Astrophysical Journal. The infrared images and spectrum were not taken at exactly the same time, and variability could account for some of the mismatch between them. A more complicated jet with multiple emitting regions also remains possible.\n\n**Measured:** Webb found a curved mid-infrared spectrum, a turnover near 6 micrometres, and longer-wavelength emission that a single steady jet model does not reproduce cleanly.\n\n**Inferred:** warm circumbinary dust provides a coherent explanation for the spectrum, but further simultaneous infrared and radio observations are needed before the dust interpretation can be considered secure."
}