{
  "title": "Two massive stars still forming look captured, not born as a pair",
  "topic": "Stars & Stellar Evolution",
  "date": "2026-09-08",
  "freshness": "Published in Nature Astronomy on 7 September 2026.",
  "excerpt": "ALMA, the VLA, JWST, and the VLT mapped IRAS 07299-1651, two massive protostars still growing inside a molecular cloud. Nearly eight years of positions show an elongated orbit, and the disks around the two stars tilt relative to each other and to that orbit. A shared birth in one disk has trouble with that geometry. A later close encounter fits it better.",
  "whyItMatters": "Many massive stars live with a companion, and the companion changes how they exchange mass, spin, and die. This system is one case where the orbit and the tilted disks favor capture after separate births. A single shared disk would have lined the stars and the disks up together. One system shows a route. It does not yet show how common that route is.",
  "exploreFurther": {
    "label": "Nature Astronomy: An eccentric massive protobinary assembled via a core-merger parabolic encounter",
    "url": "https://www.nature.com/articles/s41550-026-02953-z"
  },
  "whatToExploreNext": "Ask why so many massive stars have companions, and how a partner changes the path from birth to explosion.",
  "sources": [
    {
      "label": "Nature Astronomy",
      "url": "https://www.nature.com/articles/s41550-026-02953-z"
    },
    {
      "label": "ALMA Observatory",
      "url": "https://alma-telescope.jp/news/mbassemble-202609.html"
    }
  ],
  "body": "## A pair still growing, on a stretched path\n\nMany stars in the Milky Way are born with a companion. Among massive stars the pairing is especially common. A companion changes what happens next: mass can move from one star to the other, spins can be driven up, and the deaths of massive stars often look different when a partner is present. How the partnership starts is less settled. The stars might have collapsed out of one shared core, already bound. Or they might have formed apart and been captured later.\n\nIRAS 07299-1651 is a concrete case. It holds two massive protostars, still growing by pulling in gas, buried in a molecular cloud. An international team led by Yichen Zhang of Shanghai Jiao Tong University used the ALMA telescope to watch them. The Nature Astronomy paper, published on 7 September 2026, is led by Yao Wang, a doctoral student at the same university. The title states the preferred history in technical language: an eccentric massive protobinary assembled via a core-merger parabolic encounter.\n\nEccentric means the orbit is elongated, far from a tidy circle. A parabolic encounter is a close pass on a path that is just barely unbound, the kind of flyby that can end in capture if the pair loses a little energy during the meeting. Core-merger, in this usage, points at two dense star-forming cores that meet and become one bound system. The ALMA Observatory's Japanese release is the other account attached to this note.\n\n## Eight years of tiny shifts on the sky\n\nAn earlier ALMA look at the same object had already found the embedded pair and studied its motions. Those results lined up, roughly, with a familiar picture: a large gas disk splits and the two stars form together. One detail sat badly in that picture. The disks around the two protostars looked misaligned.\n\nTo test the orbit, the team measured tiny proper motions, the slow drift of each star's position on the sky. That measurement needs ALMA's angular resolution and its ability to pin positions. Stitching together observations that span nearly eight years, they caught slight shifts that trace orbital motion. Zhang's description of the result is direct. For the first time, they were seeing two massive stars, still being born, orbiting each other.\n\nALMA did not work alone. The three-dimensional picture combines ALMA data at several wavelengths with the Karl G. Jansky Very Large Array, the James Webb Space Telescope, and the European Southern Observatory's Very Large Telescope. Kei Tanaka, an assistant professor at the Institute of Science Tokyo and a coauthor, notes that the multi-wavelength ALMA data also narrowed the protostellar masses the orbit fit needs. Webb and the other infrared views located the jets, the narrow streams blowing away from the stars. ALMA resolved the compact disk around each protostar. Hydrogen recombination lines, shifted red or blue by the Doppler effect, show which way those ionized disks are spinning. Gas coming toward us shifts one way. Gas going away shifts the other. The arrows of the jets then give a third direction in space.\n\nWang has compared the assembly to a three-dimensional puzzle. Each observation added a piece. Orbit, disks, and jets eventually belonged to one picture. Ruben Fedriani of the Institute of Astrophysics of Andalusia and Jonathan C. Tan, a professor at Chalmers University of Technology and the University of Virginia, are among the coauthors. A continuum image at 0.9 millimetres shows the binary at the centre, with a reconstructed orbit drawn through it.\n\n## Why a shared disk has trouble here\n\nTwo geometric facts do the arguing. The orbit has a large eccentricity. It is a distorted, stretched path, not a near-circle. And each circumstellar disk is strongly tilted relative to the other disk and relative to the orbital plane.\n\nA single gas disk that fragments should leave a memory. The stars and their disks inherit roughly the same spin axis, the angular momentum of the parent disk. The measured arrangement does not look like that memory. The team's reading is that the two stars formed independently, met at close range while they were still growing inside the molecular cloud, and became gravitationally bound. Tan's way of putting the early stage: it is complicated, and stars that were born apart can still meet and end up bound.\n\nThat reading is a comparative fit. Nobody filmed the flyby. The together-from-birth model has trouble with the tilts and the stretched orbit. The encounter model has less trouble. The capture, if recent, also explains why the orbit is still eccentric. Tides and leftover gas can circularize an orbit later. A still-elongated path is a clue that this rounding has not finished.\n\n## One system is a route, not a census\n\nNothing here says most massive binaries formed by capture. It says this one is difficult to file under co-formation in a single disk, and that a near-parabolic encounter can assemble a massive protobinary. A rate would need many systems. The same technique can be pointed at other young, cloud-buried pairs. Earlier work could measure an on-sky separation, and only rarely a line-of-sight velocity difference. A long, precise campaign can now recover the three-dimensional layout. Future observations should tighten the orbit of IRAS 07299-1651 itself. A sample of orbits would test whether this route is common or rare. The result is a way into the binary. Planets are outside the claim.\n\nRead the Nature Astronomy article for the orbit solutions and the disk angles. Read the ALMA release for the observatory's version of the same campaign. The geometry is the measurement. Separate births plus a close gravitational meeting are the history the team prefers.\n"
}
