{
  "title": "Hubble catches a giant 10-sided wave forming around Saturn’s south pole",
  "topic": "Solar System & Planetary Science",
  "date": "2026-09-04",
  "freshness": "Published in Science Advances on 2 September 2026, within the 15-day freshness window.",
  "excerpt": "Hubble and ground-based observations have revealed a giant decagonal atmospheric wave around Saturn’s south pole, the first large regular-sided jet pattern ever seen in the planet’s southern hemisphere. Faint signs appear in data from 2023 and 2024, while the structure became much clearer in 2025, suggesting astronomers may be watching a huge planetary weather pattern develop in real time.",
  "whyItMatters": "Saturn’s famous north-polar hexagon has persisted for decades, but this newly emerging southern decagon appears younger and more dynamic. Following it as it evolves could help scientists understand how giant atmospheric waves form, why Saturn produces polygon-shaped jet patterns, and whether such structures can become long-lived.",
  "exploreFurther": {
    "label": "Science Advances: A decagon wave around Saturn’s south pole",
    "url": "https://doi.org/10.1126/sciadv.aee4251"
  },
  "whatToExploreNext": "Explore Saturn’s north-polar hexagon and why a jet stream can organize into a stable geometric wave instead of a simple circular band.",
  "sources": [
    {
      "label": "Science Advances",
      "url": "https://doi.org/10.1126/sciadv.aee4251"
    },
    {
      "label": "NASA Hubble",
      "url": "https://science.nasa.gov/missions/hubble/nasas-hubble-tracks-new-decagon-encircling-saturns-south-pole/"
    },
    {
      "label": "University of Leicester",
      "url": "https://le.ac.uk/news/2026/august/observations-mysterious-shape-saturn-clouds"
    }
  ],
  "body": "## A ten-sided wave, still settling in\n\nHubble has caught a giant decagonal wave around Saturn’s south pole. It is the first large, regular-sided jet pattern seen in the planet’s southern hemisphere. Faint signs are in data from 2023 and 2024. By 2025 the shape was much clearer. The paper is in Science Advances, 2 September 2026.\n\nThat timeline is the interesting part. Saturn’s north-polar hexagon has been there every time observers have looked, for more than 40 years. Amy Simon, co-author and principal investigator of Hubble’s Outer Planet Atmospheres Legacy program at NASA Goddard, says this southern feature is different: it appears to be strengthening. The OPAL program has photographed the outer planets once a year for more than a decade, which is why a slow pattern can be caught in the act instead of as a single postcard.\n\nThe south pole has also been hard to see. Saturn’s seasons tipped it back into view from Earth. Ground-based observers found it first. Agustín Sánchez-Lavega, at the University of the Basque Country, leads the study. He and amateur astronomers Trevor Barry and Jean-Paul Oger noticed a subtle undulating band in 2024 images contributed to the Planetary Virtual Observatory Laboratory. 2025 ground images pushed harder toward a ten-sided shape. Hubble then confirmed the feature was already present in 2023.\n\n## Not a cloud doodle\n\nThe wave sits in one of Saturn’s jet streams and extends through several layers of the atmosphere. Different Hubble filters look at different altitudes, and the apparent position of the decagon shifts slightly between them. That shift is evidence the structure is vertically extended, not a stain on the cloud tops.\n\nSánchez-Lavega’s group had been looking for a southern twin of the hexagon in Hubble images since 1990, because the north-south jet system is roughly symmetric. Cassini, in orbit from 2004 to 2017, showed no long-lived southern polygon. So this is new on a planet we have watched closely. Simon’s question is the right one: why did it form now?\n\n## What is measured, and what is still open\n\nMeasured: a ten-sided wave, multi-layered, emerging over 2023–2025, first large regular polygon in the south. Interpreted, not yet shown: that it will last for decades the way the hexagon has, or that the same fluid mechanics produced both shapes. The authors want more Hubble time, JWST, and computer models before they will say how it formed, how long it may last, or how it compares with the north.\n\nA jet can prefer a polygon over a circle when the wind’s speed changes sharply with latitude and the waves that fit inside that shear lock into a standing pattern. The hexagon is the textbook case. A decagon would be a different number of sides in a different jet, possibly a younger one. Copying the hexagon’s explanation onto the south pole is the temptation. The data so far only justify the geometry and the fact that it is growing.\n\nMike Wong, a co-author at UC Berkeley, notes that OPAL’s finds tend to come from the stack of years, not from one visit. This decagon is that kind of find. Science Advances (DOI 10.1126/sciadv.aee4251) carries the analysis. NASA’s Hubble write-up and the University of Leicester’s note are the institutional accounts. The next useful comparison is the northern hexagon itself: a jet that chose a shape and then kept it, which this southern wave has not yet had time to do.\n"
}
