{
  "title": "S301 may let astronomers measure the spin of Sagittarius A*",
  "topic": "Black Holes / Gravity & Fundamental Physics",
  "date": "2026-08-28",
  "freshness": "ESO announced the result on 19 August 2026. The paper is in Nature.",
  "excerpt": "S301 is the fastest known star in the Milky Way. At its closest approach to Sagittarius A*, it moves at about 25,000 kilometres per second, a bit over 8 percent of light speed, on an 8.7-year orbit that comes in near Saturn's distance. ESO reported the star on 19 August 2026. Later close passes may show the black hole's spin. That spin has not been measured.",
  "whyItMatters": "A spinning black hole drags spacetime, and that drag should show up in the orbit of a star this close and this fast. S301 gives observers a practical target for the test. The spin itself has not been measured. The orbit is the new tool, and the number is still ahead.",
  "exploreFurther": {
    "label": "ESO: S301 and the spin of Sagittarius A*",
    "url": "https://eso.org/public/news/eso2612/"
  },
  "whatToExploreNext": "Follow how GRAVITY+ on the Very Large Telescope Interferometer times stellar orbits at the Galactic Centre, and what the 2031 close pass could add to a spin measurement.",
  "sources": [
    {
      "label": "ESO",
      "url": "https://eso.org/public/news/eso2612/"
    }
  ],
  "body": "## A star on a very short leash\n\nS301 is the fastest star known in the Milky Way. At its closest pass to Sagittarius A*, the black hole at the Galactic Centre, it moves at about 25,000 kilometres per second. That is a bit over 8 percent of the speed of light. The black hole holds about four million times the mass of the Sun. The orbit takes 8.7 years. Closest approach is about 12 times the Earth-Sun distance, 1.78 billion kilometres, only about 20 percent farther than Saturn's distance from the Sun. No other star yet observed comes in that tight.\n\nESO announced the orbit on 19 August 2026. The paper, from the GRAVITY+ collaboration, is in Nature. The observations used the Very Large Telescope Interferometer at Paranal. Four 8-metre telescopes combine their light so they act as one. An interferometer does that on purpose: the sharpness comes from the separation between the telescopes, not from any single mirror. The instrument is GRAVITY, now in an upgraded form called GRAVITY+. Frank Eisenhauer, the GRAVITY+ principal investigator, notes that no other observatory has four telescopes of that size working as a single interferometer. The star is about two billion times fainter than Betelgeuse. They first caught it in spring 2023, traced the orbit back to 2017, and found that the last close pass was early 2023. The next one is in 2031.\n\nSpeed, period, closest distance, and a detection history are in hand. The spin of the black hole is not among them.\n\n## What a spin would do, if the orbit is known well enough\n\nA spinning black hole drags spacetime around with it. The drag should shift the path of a nearby star, and the shift grows when the star is close and fast. Relativistic, in this setting, means the piece of Einstein's gravity that stays small around Earth and shows up when speeds are a noticeable fraction of light speed and the mass is packed into a black hole. S301 spends the inner part of its orbit in that regime. S2 and the other famous Galactic Centre stars were the previous best stars for measuring the same drag. They do not pass as close.\n\nFelix Mang, a PhD student at the Max Planck Institute for Extraterrestrial Physics and an author of the study, is attached to a hope that should stay a hope. Within about ten years, this star could yield the spin of Sagittarius A*. Stefan Gillessen, who led much of the work with him, calls that a direct spin measurement and a sharp test of general relativity. It has not been done. One orbit is not enough. The team wants at least two full, well-sampled orbits so the trajectory is known tightly enough to see a small twist.\n\nJuan Osorno, at the Paris Observatory, puts the practical consequence in plain terms. Without this star, the same spin measurement from the older stars would take several more decades. Reinhard Genzel, whose group's long campaign of stellar orbits helped establish the black hole, calls S301 a new window on spacetime near Sagittarius A*. The window is the orbit. The number for the spin is still ahead.\n\nThat reading is an interpretation of what a well-sampled orbit ought to contain. The data in hand are the path, not the twist.\n\n## A torn pair is a fit, not a sighting\n\nStars do not form this close to the black hole. Tides in that neighbourhood pull a gas cloud apart before it can collapse into a star, so the usual inference is that S301 arrived from farther out. ESO labels the arrival story as an inference. The orbit fits a binary that was torn apart: one star captured onto the tight ellipse, the companion kicked out fast enough that it may have left the Galaxy. \"Likely\" is the word in the release. It is a clean dynamical story. Nobody has reported the ejected partner.\n\nOther ways of dropping a single star onto such an ellipse are harder to square with that hostile inner region, which is why the torn-binary picture is the one the release prefers. Preference is not a detection. The orbit can be matched by a disrupted pair. That match does not prove the pair existed.\n\n## 2031 is the next real test\n\nMICADO, an instrument for ESO's Extremely Large Telescope, is named alongside GRAVITY+ as the follow-up. The 2031 pericentre is the next time the relativistic effects are strongest. Pericentre is just the closest point on the orbit. Missing that pass would weaken the chance of seeing any spin signal. Catching it, together with the track before and after, is the actual experiment.\n\nUntil that analysis is published, any figure offered as the spin of Sagittarius A* did not come from S301. What is in hand is the star, the speed, the period, the closest distance, the instrument, and a route to a measurement the older stars were not going to deliver on a short clock. What is not in hand is the spin. ESO's release eso2612 is the public account. The Nature paper is the authority for the orbital fit. Those two lists should not be folded into each other.\n"
}
